{
  "$schema": "../../schema/tracks.schema.json",
  "conceptId": "ryans-cover2-palms-read",
  "duration": 4,
  "offense": [
    {
      "id": "C",
      "label": "C",
      "side": "offense",
      "role": "ol",
      "trail": "block",
      "assignment": "Pass block 1-tech NT",
      "waypoints": [
        { "t": 0, "x": 26.67, "y": -0.4, "note": "Snap" },
        { "t": 1, "x": 26.5, "y": -0.8, "note": "Engage NT" },
        { "t": 2.2, "x": 26.3, "y": -1.6, "note": "Hold A-gap" },
        { "t": 4, "x": 26, "y": -2.2, "note": "Anchor" }
      ]
    },
    {
      "id": "LG",
      "label": "LG",
      "side": "offense",
      "role": "ol",
      "trail": "block",
      "assignment": "Help C on NT",
      "waypoints": [
        { "t": 0, "x": 25, "y": -0.4, "note": "Set inside" },
        { "t": 1, "x": 25.2, "y": -0.8, "note": "Double NT" },
        { "t": 2.2, "x": 25, "y": -1.5, "note": "Hold line" },
        { "t": 4, "x": 24.8, "y": -2, "note": "Protect pocket" }
      ]
    },
    {
      "id": "LT",
      "label": "LT",
      "side": "offense",
      "role": "ol",
      "trail": "block",
      "assignment": "Pass block WDE Wide-9 rush",
      "waypoints": [
        { "t": 0, "x": 23.3, "y": -0.4, "note": "Kick slide to Wide-9" },
        { "t": 1, "x": 21.8, "y": -1.2, "note": "Contact WDE" },
        { "t": 2.4, "x": 21.2, "y": -2.6, "note": "Straining" },
        { "t": 4, "x": 20.8, "y": -3.8, "note": "Giving ground" }
      ]
    },
    {
      "id": "RG",
      "label": "RG",
      "side": "offense",
      "role": "ol",
      "trail": "block",
      "assignment": "Pass block 3T DT",
      "waypoints": [
        { "t": 0, "x": 28.3, "y": -0.4, "note": "Vertical set" },
        { "t": 1, "x": 28.8, "y": -0.8, "note": "Engage 3T" },
        { "t": 2.2, "x": 28.6, "y": -1.6, "note": "Pushed back" },
        { "t": 4, "x": 28.4, "y": -2.4, "note": "Pocket compressed" }
      ]
    },
    {
      "id": "RT",
      "label": "RT",
      "side": "offense",
      "role": "ol",
      "trail": "block",
      "assignment": "Pass block SDE Wide-9 rush",
      "waypoints": [
        { "t": 0, "x": 30, "y": -0.4, "note": "Kick slide to Wide-9" },
        { "t": 1, "x": 32.2, "y": -1.2, "note": "Engage SDE" },
        { "t": 2.4, "x": 32.5, "y": -2.8, "note": "Straining vs speed rush" },
        { "t": 4, "x": 32.2, "y": -3.8, "note": "Edge pushed" }
      ]
    },
    {
      "id": "QB",
      "label": "QB",
      "side": "offense",
      "role": "qb",
      "trail": "drop",
      "assignment": "3-step drop, read Smash concept (H out / X corner) -> baited by Palms trap!",
      "waypoints": [
        { "t": 0, "x": 26.67, "y": -4.5, "note": "Snap" },
        { "t": 1, "x": 26.67, "y": -6, "note": "3-step drop, identify 2-high shell" },
        { "t": 1.8, "x": 26.67, "y": -6, "note": "Read H out route: LCB traps out, SS caps corner!" },
        { "t": 2.6, "x": 26.67, "y": -6, "note": "Pass thrown to H out route is jumped by LCB for INT!" },
        { "t": 4, "x": 26.67, "y": -6, "note": "Turnover forced" }
      ]
    },
    {
      "id": "RB",
      "label": "RB",
      "side": "offense",
      "role": "rb",
      "trail": "block",
      "assignment": "Check-release to middle hook",
      "waypoints": [
        { "t": 0, "x": 29.5, "y": -4.5, "note": "Scan A/B gap" },
        { "t": 1.2, "x": 28.5, "y": -2.5, "note": "Check release" },
        { "t": 2.4, "x": 27.5, "y": 1, "note": "Hook over ball" },
        { "t": 4, "x": 27, "y": 2, "note": "Covered by MIKE" }
      ]
    },
    {
      "id": "X",
      "label": "X",
      "side": "offense",
      "role": "wr",
      "trail": "route",
      "assignment": "Smash concept #1: 12yd Corner route behind H out",
      "waypoints": [
        { "t": 0, "x": 8, "y": -0.5, "note": "Vertical stem" },
        { "t": 1.2, "x": 8, "y": 6.5, "note": "Drive outside" },
        { "t": 2.2, "x": 10.5, "y": 12, "note": "Break to corner: SS is waiting over top!" },
        { "t": 4, "x": 6, "y": 18, "note": "Blanketed by safety" }
      ]
    },
    {
      "id": "H",
      "label": "H",
      "side": "offense",
      "role": "wr",
      "trail": "route",
      "assignment": "Smash concept #2: 5yd Quick Out route (Target of play)",
      "waypoints": [
        { "t": 0, "x": 16, "y": -0.8, "note": "Speed release" },
        { "t": 0.8, "x": 16, "y": 3.5, "note": "Plant and break hard to sideline" },
        { "t": 1.8, "x": 11.5, "y": 4.8, "note": "Sprint to boundary: LCB jumps directly in path!" },
        { "t": 2.6, "x": 9.5, "y": 5, "note": "Pass intercepted by LCB" },
        { "t": 4, "x": 8, "y": 6, "note": "Play dead" }
      ]
    },
    {
      "id": "Y",
      "label": "Y",
      "side": "offense",
      "role": "wr",
      "trail": "route",
      "assignment": "Field slot 10yd Out route",
      "waypoints": [
        { "t": 0, "x": 36.5, "y": -0.8, "note": "Vertical stem" },
        { "t": 1.2, "x": 36.5, "y": 6, "note": "Drive on NICKEL" },
        { "t": 2.2, "x": 41.5, "y": 9.5, "note": "Break to sideline" },
        { "t": 4, "x": 46, "y": 10.5, "note": "Trapped by RCB Palms read" }
      ]
    },
    {
      "id": "Z",
      "label": "Z",
      "side": "offense",
      "role": "wr",
      "trail": "route",
      "assignment": "Field #1 12yd Post route",
      "waypoints": [
        { "t": 0, "x": 45.5, "y": -0.5, "note": "Vertical release" },
        { "t": 1.2, "x": 45.5, "y": 6.5, "note": "Inside stem" },
        { "t": 2.4, "x": 40, "y": 13, "note": "Post break" },
        { "t": 4, "x": 34, "y": 19, "note": "Capped by FS deep half" }
      ]
    }
  ],
  "defense": [
    {
      "id": "WDE",
      "label": "WDE",
      "side": "defense",
      "role": "dl",
      "trail": "block",
      "assignment": "Wide-9 edge rush: compress pocket left",
      "waypoints": [
        { "t": 0, "x": 20, "y": 0.9, "note": "Wide-9 stance" },
        { "t": 1, "x": 19.5, "y": -0.8, "note": "Speed rush on LT" },
        { "t": 2.4, "x": 20.8, "y": -3.5, "note": "Collapse pocket" },
        { "t": 4, "x": 23.5, "y": -6, "note": "Pursuit" }
      ]
    },
    {
      "id": "NT",
      "label": "NT",
      "side": "defense",
      "role": "dl",
      "trail": "block",
      "assignment": "1-Tech push rush on Center",
      "waypoints": [
        { "t": 0, "x": 25.5, "y": 0.9, "note": "1-tech stance" },
        { "t": 1, "x": 25.8, "y": -0.4, "note": "Bull rush" },
        { "t": 2.2, "x": 25.6, "y": -1.5, "note": "Push pocket" },
        { "t": 4, "x": 25.5, "y": -2.5, "note": "Anchor" }
      ]
    },
    {
      "id": "3T",
      "label": "3T",
      "side": "defense",
      "role": "dl",
      "trail": "block",
      "assignment": "3-Tech upfield rush on RG",
      "waypoints": [
        { "t": 0, "x": 29, "y": 0.9, "note": "3-tech stance" },
        { "t": 1, "x": 29.2, "y": -0.4, "note": "Club RG" },
        { "t": 2.2, "x": 28.8, "y": -1.6, "note": "Collapse right side" },
        { "t": 4, "x": 27.5, "y": -3.5, "note": "Flush QB" }
      ]
    },
    {
      "id": "SDE",
      "label": "SDE",
      "side": "defense",
      "role": "dl",
      "trail": "block",
      "assignment": "Wide-9 edge rush: speed contain on RT",
      "waypoints": [
        { "t": 0, "x": 34, "y": 0.9, "note": "Wide-9 stance" },
        { "t": 1, "x": 34.5, "y": -0.8, "note": "Speed rush" },
        { "t": 2.4, "x": 33.2, "y": -3, "note": "Squeeze pocket" },
        { "t": 4, "x": 30, "y": -5.5, "note": "Pursuit" }
      ]
    },
    {
      "id": "WILL",
      "label": "WILL",
      "side": "defense",
      "role": "lb",
      "trail": "drop",
      "assignment": "Weak hook dropper: wall off underneath crossers",
      "waypoints": [
        { "t": 0, "x": 22, "y": 4.5, "note": "LB alignment" },
        { "t": 1, "x": 20, "y": 5.5, "note": "Drop to weak hook" },
        { "t": 2.2, "x": 18, "y": 7, "note": "Wall off inside throwing lane" },
        { "t": 4, "x": 17, "y": 8, "note": "Underneath protected" }
      ]
    },
    {
      "id": "MIKE",
      "label": "MIKE",
      "side": "defense",
      "role": "lb",
      "trail": "drop",
      "assignment": "Strong hook dropper: match RB release",
      "waypoints": [
        { "t": 0, "x": 27, "y": 4.5, "note": "LB alignment" },
        { "t": 1, "x": 28, "y": 5.5, "note": "Drop to strong hook" },
        { "t": 2.2, "x": 28.5, "y": 7, "note": "Match RB hook" },
        { "t": 4, "x": 28, "y": 8, "note": "RB smothered" }
      ]
    },
    {
      "id": "NICKEL",
      "label": "NICK",
      "side": "defense",
      "role": "db",
      "trail": "drop",
      "assignment": "Palms match on #2 Y: carry vertical / drive on under",
      "waypoints": [
        { "t": 0, "x": 36.5, "y": 4, "note": "Apex over slot Y" },
        { "t": 1, "x": 37, "y": 6, "note": "Read Y release" },
        { "t": 2.2, "x": 38.5, "y": 8, "note": "Rally on Y out route" },
        { "t": 4, "x": 40, "y": 9, "note": "Bracket Y" }
      ]
    },
    {
      "id": "LCB",
      "label": "LCB",
      "side": "defense",
      "role": "db",
      "trail": "drop",
      "assignment": "Palms Read (2-Read): read #2 inside; #2 out = jump out route for INT!",
      "waypoints": [
        { "t": 0, "x": 8, "y": 6.5, "note": "Off coverage: eyes locked on #2 slot H" },
        { "t": 0.8, "x": 8.5, "y": 6, "note": "Read H break outside: Trigger downhill hard!" },
        { "t": 1.8, "x": 10, "y": 4.8, "note": "Undercut H out route in front of receiver!" },
        { "t": 2.6, "x": 9.5, "y": 5, "note": "Intercept football with forward momentum!" },
        { "t": 4, "x": 8, "y": 10, "note": "Pick-six return down sideline" }
      ]
    },
    {
      "id": "RCB",
      "label": "RCB",
      "side": "defense",
      "role": "db",
      "trail": "drop",
      "assignment": "Palms Read (2-Read): read #2 Y out; trigger on Y",
      "waypoints": [
        { "t": 0, "x": 45.5, "y": 6.5, "note": "Off alignment reading #2" },
        { "t": 1, "x": 45, "y": 6.5, "note": "Read Y out cut" },